entry_number,scopus_id,doi,title,authors,year,date,publication,citations,query
119,,10.1021/acs.jcim.3c00670,Unlocking the Full Potential of Heteroatom-Doped Graphene-Based Supercapacitors through Stacking Models and SHAP-Guided Optimization,Krittapong Deshsorn,2023,2023-08-10,Journal of Chemical Information and Modeling,30,graphene supercapacitor
120,,10.1021/acs.jpcc.3c04956,Insights into Heteroatom-Doped Graphene Supercapacitor Data through Manual Data Separation and Statistical Analysis,Kulpavee Jitapunkul,2023,2023-08-16,The Journal of Physical Chemistry C,19,graphene supercapacitor
121,,10.1016/j.est.2023.108733,Recycled magnetic materials (BaFe12O19 and Fe3O4) for the enhancement of capacitance/energy-density in graphene supercapacitors,L. Ojeda,2023,2023-08-18,Journal of Energy Storage,20,graphene supercapacitor
122,,10.1016/j.apsusc.2023.158696,Enhanced performance of densified laser-induced graphene supercapacitor electrodes in dimpled polyimide,Changyoung Ryu,2023,2023-10-16,Applied Surface Science,42,graphene supercapacitor
123,,10.1016/j.matchemphys.2023.128721,Stretchable supercapacitors made with plasticine/graphene/CeNdNiO2 composite electrodes,L. Garcés,2023,2023-11-25,Materials Chemistry and Physics,8,graphene supercapacitor
124,,10.1016/j.cej.2023.147894,Recyclable liquid metal – Graphene supercapacitor,Afsaneh L. Sanati,2023,2023-12-07,Chemical Engineering Journal,25,graphene supercapacitor
125,,10.1002/slct.202302535,Alloy/Perovskite Compounds Modified by Plasma Treatment and their Role in Enhancing the Capacitance of Sustainable Graphene Supercapacitors,Ricardo Mendoza,2024,2024-01-09,ChemistrySelect,2,graphene supercapacitor
126,,10.1016/j.cej.2024.148822,High-performance redox-active organic molecule grafted graphene based on-chip micro-supercapacitor towards self-powered environmental monitoring station,V. C. Ravichandran,2024,2024-01-18,Chemical Engineering Journal,31,graphene supercapacitor
127,,10.1016/j.diamond.2024.110842,Copper oxide incorporated ball-mill produced less-defective graphene for hybrid supercapacitors,Suchitra Vattapparambil Chandran,2024,2024-01-23,Diamond and Related Materials,21,graphene supercapacitor
128,,10.1016/j.jpowsour.2024.234127,How false data affects machine learning models in electrochemistry?,Krittapong Deshsorn,2024,2024-02-01,Journal of Power Sources,14,graphene supercapacitor
129,,10.1002/adfm.202315137,Vascular System Inspired 3D Electrolyte Network for High Rate and High Mass Loading Graphene Supercapacitor,Congming Li,2024,2024-02-29,Advanced Functional Materials,32,graphene supercapacitor
130,,10.1038/s41598-024-57932-z,Improving high throughput manufacture of laser-inscribed graphene electrodes via hierarchical clustering,Hanyu Qian,2024,2024-04-05,Scientific Reports,12,graphene supercapacitor
131,,10.1016/j.molliq.2024.124855,Atomistic insights into the superior performance of C60-decorated graphene supercapacitors,Isabel A. Silva,2024,2024-05-06,Journal of Molecular Liquids,10,graphene supercapacitor
132,,10.1016/j.jallcom.2024.175000,Enhancing the capacitance and robustness of graphene supercapacitors by adding a coating of activated-carbon/Bi2Al4O9 on their electrodes,L. Ojeda,2024,2024-05-27,Journal of Alloys and Compounds,5,graphene supercapacitor
133,,10.1002/asia.202400548,"A High-Performance, Low Defected, and Binder-Free Graphene-Based Supercapacitor Obtained via Synergistic Electrochemical Exfoliation and Electrophoretic Deposition Process",Oktaviardi Bityasmawan Abdillah,2024,2024-07-02,Chemistry - An Asian Journal,6,graphene supercapacitor
134,,10.1021/acsami.4c07094,Enhanced Performance of Laser-Induced Graphene Supercapacitors via Integration with Candle-Soot Nanoparticles,Arnab Ghosh,2024,2024-07-25,ACS Applied Materials & Interfaces,26,graphene supercapacitor
135,,10.1016/j.jallcom.2024.177248,From graphene aerogels to efficient energy storage: current developments and future prospects,Tholkappiyan Ramachandran,2024,2024-10-24,Journal of Alloys and Compounds,84,graphene supercapacitor
136,,10.1016/j.surfin.2024.105581,Laser repeat scanning preparation of nitrogen sulfur doped graphene supercapacitor,S.-L. Chen,2024,2024-12-06,Surfaces and Interfaces,2,graphene supercapacitor
137,,10.1016/j.isci.2024.111696,Boosting flexible laser-induced graphene supercapacitors performance through double pass laser processing,Assia Hamada,2024,2024-12-26,iScience,8,graphene supercapacitor
138,,10.1016/j.jpowsour.2024.236149,High-yield liquid phase production of high-quality graphene via dimethylacetamide-ethanol mixed solvent system,Tianxiang Lv,2024,2024-12-31,Journal of Power Sources,3,graphene supercapacitor
